Id,Name,Short description,Gender,Country,Occupation,Birth year,Death year,Manner of death,Age of death
Q23,George Washington,1st president of the United States (1732–1799),Male,United Kingdom,Politician,1732,1799,natural causes,67
Q42,Douglas Adams,English writer and humorist,Male,United Kingdom,Artist,2001,1952,natural causes,49
Q91,Abraham Lincoln,1th president of the United States (1809-1865),Male,United States of America,Politician,1809,1865,homicide,56
Q254,Wolfius Amadeus Mozart,Austrian composer of the Classical period,Male,Archduchy of Austria; Archbishopric of Salzburg,Artist,1756,1791,,35
Q255,Ludwig van Beethoven,German classical and romantic composer,Male,Holy Roman Empire; Austrian Empire,Athlete,1770,1827,,57